{
  "schema_version": 1,
  "toolchain_id": "avidscript-wasmtime-v45.0.0-patchset.3-win64-multiarch",
  "platform": "Win64",
  "upstream": {
    "version": "v45.0.0",
    "commit": "377cd917af258d932d55b201a646917ecf193639",
    "source_archive": {
      "name": "wasmtime-377cd917af258d932d55b201a646917ecf193639.zip",
      "url": "https://github.com/bytecodealliance/wasmtime/archive/377cd917af258d932d55b201a646917ecf193639.zip",
      "size_bytes": 30796505,
      "sha256": "ec48aaa650ecca1b7b8f3c6deaee0067676cb2e201721aa0e6397f15149baff0",
      "root": "wasmtime-377cd917af258d932d55b201a646917ecf193639"
    }
  },
  "patch": {
    "relative_path": "Source/ThirdParty/Wasmtime/PerformanceToolchain/avidscript-wasmtime-v45-inlining.patch",
    "canonical_sha256": "1635067d97b9af7fdc4c1cf85c5b4b0b0d9141a86ad1c1401c624484d2170b1c",
    "export_symbol": "avidscript_wasmtime_config_compiler_inlining_set",
    "precompile_export_symbol": "avidscript_wasmtime_engine_precompile_module",
    "api_revision": 1
  },
  "rust": {
    "toolchain": "1.93.0-x86_64-pc-windows-msvc",
    "minimum_rustc": "1.93.0",
    "package": "wasmtime-c-api",
    "build_profile": "fastest-runtime",
    "features": [
      "cranelift",
      "all-arch",
      "parallel-compilation",
      "gc",
      "gc-drc",
      "disable-logging"
    ],
    "cmake_arguments": [
      "-G",
      "Visual Studio 17 2022",
      "-A",
      "x64",
      "-DBUILD_SHARED_LIBS=ON",
      "-DCMAKE_BUILD_TYPE=Release",
      "-DWASMTIME_FASTEST_RUNTIME=ON",
      "-DWASMTIME_DISABLE_ALL_FEATURES=ON",
      "-DWASMTIME_FEATURE_CRANELIFT=ON",
      "-DWASMTIME_FEATURE_ALL_ARCH=ON",
      "-DWASMTIME_FEATURE_PARALLEL_COMPILATION=ON",
      "-DWASMTIME_FEATURE_GC=ON",
      "-DWASMTIME_FEATURE_GC_DRC=ON",
      "-DWASMTIME_FEATURE_DISABLE_LOGGING=ON"
    ],
    "source_date_epoch": 1779385346
  },
  "install": {
    "relative_path": "Source/ThirdParty/Wasmtime/installed/Win64/v45.0.0-avidscript.3",
    "managed_marker_name": ".avidscript-wasmtime-performance-managed.json"
  },
  "layout": {
    "include_relative_path": "include",
    "dll_relative_path": "lib/wasmtime.dll",
    "import_library_relative_path": "lib/wasmtime.dll.lib",
    "license_relative_path": "LICENSE"
  },
  "compiler_profile": {
    "id": "cranelift-speed-x86_64-v3-contained-v3",
    "strategy": "cranelift",
    "optimization": "speed",
    "register_allocator": "backtracking",
    "inlining": "all",
    "cpu": "x86-64-v3",
    "wasm32_memory_reservation_bytes": 4294967296,
    "max_wasm_stack_bytes": 2097152,
    "memory_may_move": false,
    "spectre_mitigation": true,
    "nan_canonicalization": false,
    "wasm_gc": true,
    "consume_fuel": true,
    "epoch_interruption": true,
    "gc_collector": "drc"
  },
  "fuel_free_compiler_profile": {
    "id": "cranelift-speed-x86_64-v3-fuel-free-v1",
    "strategy": "cranelift",
    "optimization": "speed",
    "register_allocator": "backtracking",
    "inlining": "all",
    "cpu": "x86-64-v3",
    "wasm32_memory_reservation_bytes": 4294967296,
    "max_wasm_stack_bytes": 2097152,
    "memory_may_move": false,
    "spectre_mitigation": true,
    "nan_canonicalization": false,
    "wasm_gc": true,
    "consume_fuel": false,
    "epoch_interruption": true,
    "gc_collector": "drc"
  },
  "trusted_cooperative_compiler_profile": {
    "id": "cranelift-speed-x86_64-v3-trusted-cooperative-v1",
    "strategy": "cranelift",
    "optimization": "speed",
    "register_allocator": "backtracking",
    "inlining": "all",
    "cpu": "x86-64-v3",
    "wasm32_memory_reservation_bytes": 4294967296,
    "max_wasm_stack_bytes": 2097152,
    "memory_may_move": false,
    "spectre_mitigation": true,
    "nan_canonicalization": false,
    "wasm_gc": true,
    "consume_fuel": false,
    "epoch_interruption": false,
    "gc_collector": "drc"
  },
  "license": {
    "expression": "Apache-2.0 WITH LLVM-exception",
    "tracked_file": "Source/ThirdParty/Wasmtime/LICENSE.txt"
  }
}
